{
  "event_id": "PSPS-DEMO-01",
  "notice_type": "warning",
  "issued_at": "2026-10-26T08:30:00-07:00",
  "start": "2026-10-27T18:00:00-07:00",
  "end": "2026-10-29T12:00:00-07:00",
  "area_name": "Cameron Park, Shingle Springs and Placerville (El Dorado County)",
  "source_text": "PG&E PUBLIC SAFETY POWER SHUTOFF (PSPS) WARNING\nEvent ID: PSPS-DEMO-01\nIssued: Monday, October 26, 2026, 8:30 AM PDT\n\nThis is a Medical Baseline customer alert from PG&E. Forecast high winds and very dry conditions may require PG&E to turn off power to your area to reduce the risk of wildfire.\n\nArea: Cameron Park, Shingle Springs and Placerville (El Dorado County)\n\nEstimated power shutoff: Tuesday, October 27, 2026, 6:00 PM PDT\nEstimated power restoration: Thursday, October 29, 2026, 12:00 PM PDT\n\nRestoration times are estimates. After the weather passes, crews inspect the lines before power comes back.\n\nIf you use power for medical equipment, make a backup plan now. Charge devices and keep a list of emergency contacts.\n\nQuestions: call 555-0199. For a medical emergency, call 911.\n\n(Simulated notice for the Lumen demo. Not issued by PG&E.)\n"
}
